{
  "schemaVersion": 1,
  "id": "00000000-0000-4000-8000-000000000001",
  "name": "Synthetic Empty Sprite",
  "canvas": {
    "width": 48,
    "height": 48,
    "pixelAspectWidth": 1,
    "pixelAspectHeight": 1
  },
  "colorMode": "rgba",
  "colorProfile": "sRGB",
  "layers": [
    {
      "id": "00000000-0000-4000-8000-000000000010",
      "name": "Layer 1",
      "kind": "image",
      "visible": true,
      "locked": false,
      "continuous": false,
      "opacity": 255,
      "blendMode": "normal",
      "cels": [
        {
          "id": "00000000-0000-4000-8000-000000000040",
          "frameId": "00000000-0000-4000-8000-000000000020",
          "pixelContentId": "00000000-0000-4000-8000-000000000030",
          "position": {
            "x": 0,
            "y": 0
          },
          "opacity": 255,
          "zIndex": 0
        }
      ]
    }
  ],
  "frames": [
    {
      "id": "00000000-0000-4000-8000-000000000020",
      "number": 0,
      "durationMilliseconds": 100
    }
  ],
  "tags": [],
  "slices": [],
  "palettes": [],
  "tilesets": [],
  "metadata": {
    "userData": {}
  },
  "pixelContents": [
    {
      "id": "00000000-0000-4000-8000-000000000030",
      "width": 48,
      "height": 48,
      "encoding": "rgba32",
      "entryName": "pixels/00000000000040008000000000000030.rgba"
    }
  ]
}
